{
  "schema_version": "1.0",
  "job_id": "job-full-001",
  "trace_id": "trace-pair13-demo",
  "job_type": "FULL_CHECK",
  "status": "SUCCEEDED",
  "input": {
    "repository": {
      "url": "https://github.com/example/tiny-greeting.git",
      "commit": "aaaaaaaaaaaaaaaaaaaaaaaaaaaaaaaaaaaaaaaa"
    },
    "environment": {"configuration_id": "gcc-default"}
  },
  "output": {
    "findings": [
      {"type": "MISSING", "target": "main.o", "dependency": "config.h"}
    ],
    "actual_graph_uri": "artifact://pair13/job-full-001/actual.json"
  },
  "error": null
}
