{
  "schema_version": "1.0",
  "job_id": "job-repair-003",
  "trace_id": "trace-pair13-no-valid-candidate",
  "job_type": "REPAIR",
  "status": "SUCCEEDED",
  "input": {
    "repository": {
      "url": "https://github.com/example/tiny-greeting.git",
      "commit": "aaaaaaaaaaaaaaaaaaaaaaaaaaaaaaaaaaaaaaaa"
    },
    "md_report_uri": "artifact://pair13/job-full-a13-001/md-report.json",
    "makefile_path": "Makefile",
    "environment": {"configuration_id": "gcc-default"},
    "build_command": "make clean && make",
    "verify_command": "./app"
  },
  "output": {
    "repair_status": "NO_VALID_CANDIDATE",
    "patch_uri": null,
    "build_exit_code": 0,
    "verify_exit_code": 0,
    "remaining_md_count": 1,
    "consumed_findings": [],
    "skipped_findings": [],
    "recheck": {
      "tool": "COURSE_ORACLE",
      "remaining_md_count": 1,
      "report_uri": "artifact://pair13/job-repair-003/recheck.json"
    },
    "rejected_candidates": [
      {
        "candidate_id": "cand-1",
        "summary": "main.o: main.c config.h",
        "rejection_reason": "修复后功能验证退出码非 0，候选未被接受",
        "evidence_uri": "artifact://pair13/job-repair-003/cand-1.log"
      }
    ]
  },
  "error": null
}
